08:41:27.954608 IP 10.0.2.15.37380 > 194.29.160.95.443: Flags [S], seq 3174273500, win 64240, options [mss 1460,sackOK,TS val 2640578616 ecr 0,nop,wscale 7], length 0
08:41:27.965468 IP 10.0.2.15.37382 > 194.29.160.95.443: Flags [S], seq 3061038687, win 64240, options [mss 1460,sackOK,TS val 2640578626 ecr 0,nop,wscale 7], length 0
08:41:27.980554 IP 10.0.2.15.37384 > 194.29.160.95.443: Flags [S], seq 803980381, win 64240, options [mss 1460,sackOK,TS val 2640578642 ecr 0,nop,wscale 7], length 0
08:41:27.987917 IP 194.29.160.95.443 > 10.0.2.15.37382: Flags [S.], seq 62336001, ack 3061038688, win 65535, options [mss 1460], length 0
08:41:27.987953 IP 10.0.2.15.37382 > 194.29.160.95.443: Flags [.], ack 1, win 64240, length 0
08:41:27.988004 IP 194.29.160.95.443 > 10.0.2.15.37380: Flags [S.], seq 62400001, ack 3174273501, win 65535, options [mss 1460], length 0
08:41:27.988021 IP 10.0.2.15.37380 > 194.29.160.95.443: Flags [.], ack 1, win 64240, length 0
08:41:27.989135 IP 10.0.2.15.37382 > 194.29.160.95.443: Flags [P.], seq 1:577, ack 1, win 64240, length 576
08:41:27.989753 IP 194.29.160.95.443 > 10.0.2.15.37382: Flags [.], ack 577, win 65535, length 0
08:41:27.990686 IP 10.0.2.15.37380 > 194.29.160.95.443: Flags [P.], seq 1:577, ack 1, win 64240, length 576
08:41:27.991004 IP 194.29.160.95.443 > 10.0.2.15.37380: Flags [.], ack 577, win 65535, length 0
08:41:28.004180 IP 194.29.160.95.443 > 10.0.2.15.37384: Flags [S.], seq 62464001, ack 803980382, win 65535, options [mss 1460], length 0
08:41:28.004225 IP 10.0.2.15.37384 > 194.29.160.95.443: Flags [.], ack 1, win 64240, length 0
08:41:28.004286 IP 194.29.160.95.443 > 10.0.2.15.37382: Flags [P.], seq 1:153, ack 577, win 65535, length 152
08:41:28.004302 IP 10.0.2.15.37382 > 194.29.160.95.443: Flags [.], ack 153, win 64088, length 0
08:41:28.004352 IP 194.29.160.95.443 > 10.0.2.15.37380: Flags [P.], seq 1:153, ack 577, win 65535, length 152
08:41:28.004365 IP 10.0.2.15.37380 > 194.29.160.95.443: Flags [.], ack 153, win 64088, length 0
08:41:28.004662 IP 10.0.2.15.37382 > 194.29.160.95.443: Flags [P.], seq 577:628, ack 153, win 64088, length 51
08:41:28.004922 IP 194.29.160.95.443 > 10.0.2.15.37382: Flags [.], ack 628, win 65535, length 0
08:41:28.006315 IP 10.0.2.15.37380 > 194.29.160.95.443: Flags [P.], seq 577:628, ack 153, win 64088, length 51
08:41:28.006640 IP 194.29.160.95.443 > 10.0.2.15.37380: Flags [.], ack 628, win 65535, length 0
08:41:28.007868 IP 10.0.2.15.37382 > 194.29.160.95.443: Flags [P.], seq 628:1385, ack 153, win 64088, length 757
08:41:28.008188 IP 194.29.160.95.443 > 10.0.2.15.37382: Flags [.], ack 1385, win 65535, length 0
08:41:28.009457 IP 10.0.2.15.37384 > 194.29.160.95.443: Flags [P.], seq 1:577, ack 1, win 64240, length 576
08:41:28.009818 IP 194.29.160.95.443 > 10.0.2.15.37384: Flags [.], ack 577, win 65535, length 0
08:41:28.017020 IP 10.0.2.15.37380 > 194.29.160.95.443: Flags [P.], seq 628:1070, ack 153, win 64088, length 442
08:41:28.017351 IP 194.29.160.95.443 > 10.0.2.15.37380: Flags [.], ack 1070, win 65535, length 0
08:41:28.018181 IP 10.0.2.15.37380 > 194.29.160.95.443: Flags [P.], seq 1070:1101, ack 153, win 64088, length 31
08:41:28.018269 IP 10.0.2.15.37380 > 194.29.160.95.443: Flags [F.], seq 1101, ack 153, win 64088, length 0
08:41:28.018516 IP 194.29.160.95.443 > 10.0.2.15.37380: Flags [.], ack 1101, win 65535, length 0
08:41:28.018540 IP 194.29.160.95.443 > 10.0.2.15.37380: Flags [.], ack 1102, win 65535, length 0
08:41:28.023552 IP 194.29.160.95.443 > 10.0.2.15.37384: Flags [P.], seq 1:153, ack 577, win 65535, length 152
08:41:28.023617 IP 10.0.2.15.37384 > 194.29.160.95.443: Flags [.], ack 153, win 64088, length 0
08:41:28.024423 IP 10.0.2.15.37384 > 194.29.160.95.443: Flags [P.], seq 577:628, ack 153, win 64088, length 51
08:41:28.024831 IP 194.29.160.95.443 > 10.0.2.15.37384: Flags [.], ack 628, win 65535, length 0
08:41:28.029704 IP 194.29.160.95.443 > 10.0.2.15.37380: Flags [P.], seq 153:1931, ack 1102, win 65535, length 1778
08:41:28.029750 IP 10.0.2.15.37380 > 194.29.160.95.443: Flags [R], seq 3174274602, win 0, length 0
08:41:28.153726 IP 194.29.160.95.443 > 10.0.2.15.37382: Flags [P.], seq 153:927, ack 1385, win 65535, length 774
08:41:28.153750 IP 10.0.2.15.37382 > 194.29.160.95.443: Flags [.], ack 927, win 63468, length 0
08:41:28.158836 IP 10.0.2.15.37384 > 194.29.160.95.443: Flags [P.], seq 628:1198, ack 153, win 64088, length 570
08:41:28.159196 IP 194.29.160.95.443 > 10.0.2.15.37384: Flags [.], ack 1198, win 65535, length 0
08:41:28.302225 IP 194.29.160.95.443 > 10.0.2.15.37384: Flags [P.], seq 153:1613, ack 1198, win 65535, length 1460
08:41:28.302255 IP 10.0.2.15.37384 > 194.29.160.95.443: Flags [.], ack 1613, win 63900, length 0
08:41:28.302437 IP 194.29.160.95.443 > 10.0.2.15.37384: Flags [P.], seq 1613:4533, ack 1198, win 65535, length 2920
08:41:28.302452 IP 10.0.2.15.37384 > 194.29.160.95.443: Flags [.], ack 4533, win 61060, length 0
08:41:28.302766 IP 194.29.160.95.443 > 10.0.2.15.37384: Flags [P.], seq 4533:9212, ack 1198, win 65535, length 4679
08:41:28.302785 IP 10.0.2.15.37384 > 194.29.160.95.443: Flags [.], ack 9212, win 61060, length 0
08:41:28.307113 IP 194.29.160.95.443 > 10.0.2.15.37384: Flags [P.], seq 9212:9290, ack 1198, win 65535, length 78
08:41:28.307163 IP 10.0.2.15.37384 > 194.29.160.95.443: Flags [.], ack 9290, win 63900, length 0
08:41:28.671808 IP 10.0.2.15.37384 > 194.29.160.95.443: Flags [P.], seq 1198:1699, ack 9290, win 63900, length 501
08:41:28.672172 IP 194.29.160.95.443 > 10.0.2.15.37384: Flags [.], ack 1699, win 65535, length 0
08:41:28.672273 IP 10.0.2.15.37384 > 194.29.160.95.443: Flags [P.], seq 1699:1730, ack 9290, win 63900, length 31
08:41:28.672458 IP 10.0.2.15.37384 > 194.29.160.95.443: Flags [F.], seq 1730, ack 9290, win 63900, length 0
08:41:28.672526 IP 194.29.160.95.443 > 10.0.2.15.37384: Flags [.], ack 1730, win 65535, length 0
08:41:28.673073 IP 194.29.160.95.443 > 10.0.2.15.37384: Flags [.], ack 1731, win 65535, length 0
08:41:28.687870 IP 194.29.160.95.443 > 10.0.2.15.37384: Flags [P.], seq 9290:10213, ack 1731, win 65535, length 923
08:41:28.687900 IP 10.0.2.15.37384 > 194.29.160.95.443: Flags [R], seq 803982112, win 0, length 0
08:41:28.826211 IP 10.0.2.15.37382 > 194.29.160.95.443: Flags [P.], seq 1385:2046, ack 927, win 63468, length 661
08:41:28.826611 IP 194.29.160.95.443 > 10.0.2.15.37382: Flags [.], ack 2046, win 65535, length 0
08:41:28.838094 IP 10.0.2.15.37386 > 194.29.160.95.443: Flags [S], seq 3049088165, win 64240, options [mss 1460,sackOK,TS val 2640579499 ecr 0,nop,wscale 7], length 0
08:41:28.839439 IP 10.0.2.15.37388 > 194.29.160.95.443: Flags [S], seq 1812592528, win 64240, options [mss 1460,sackOK,TS val 2640579500 ecr 0,nop,wscale 7], length 0
08:41:28.839914 IP 10.0.2.15.37390 > 194.29.160.95.443: Flags [S], seq 1927743972, win 64240, options [mss 1460,sackOK,TS val 2640579501 ecr 0,nop,wscale 7], length 0
08:41:28.869518 IP 194.29.160.95.443 > 10.0.2.15.37390: Flags [S.], seq 62592001, ack 1927743973, win 65535, options [mss 1460], length 0
08:41:28.869604 IP 10.0.2.15.37390 > 194.29.160.95.443: Flags [.], ack 1, win 64240, length 0
08:41:28.869683 IP 194.29.160.95.443 > 10.0.2.15.37388: Flags [S.], seq 62656001, ack 1812592529, win 65535, options [mss 1460], length 0
08:41:28.869706 IP 10.0.2.15.37388 > 194.29.160.95.443: Flags [.], ack 1, win 64240, length 0
08:41:28.869763 IP 194.29.160.95.443 > 10.0.2.15.37386: Flags [S.], seq 62720001, ack 3049088166, win 65535, options [mss 1460], length 0
08:41:28.869781 IP 10.0.2.15.37386 > 194.29.160.95.443: Flags [.], ack 1, win 64240, length 0
08:41:28.871097 IP 10.0.2.15.37390 > 194.29.160.95.443: Flags [P.], seq 1:577, ack 1, win 64240, length 576
08:41:28.871540 IP 194.29.160.95.443 > 10.0.2.15.37390: Flags [.], ack 577, win 65535, length 0
08:41:28.873638 IP 10.0.2.15.37388 > 194.29.160.95.443: Flags [P.], seq 1:577, ack 1, win 64240, length 576
08:41:28.873979 IP 194.29.160.95.443 > 10.0.2.15.37388: Flags [.], ack 577, win 65535, length 0
08:41:28.876008 IP 10.0.2.15.37386 > 194.29.160.95.443: Flags [P.], seq 1:577, ack 1, win 64240, length 576
08:41:28.876398 IP 194.29.160.95.443 > 10.0.2.15.37386: Flags [.